question,answer
"Give me an example of your creativity (analytical skill, managing ability, etc.).","You should have committed to memory a list of your greatest and most recent achievements, ever ready on the tip of your tongue. If you have such a list, it's easy to present any of your achievements in light of the quality the interviewer is asking about. For example, a smashing success you orchestrated at last year's trade show could be used as an example of creativity, analytical ability, or your ability to manage."
"Where could you use some improvement?","Keep this answer positive. A good way to answer is to identify a cutting-edge branch of your profession (one that's not essential to your employer's needs) as an area you're very excited about and want to explore more fully over the next six months."
"What do you worry about?","Redefine the word 'worry' so it does not reflect negatively on you. You wouldn't call it worry, but you are a strongly goal-oriented person. So you keep turning over in your mind anything that seems to be keeping you from achieving those goals, until you find a solution. That's part of your tenacity."
"How many hours a week do you normally work?","Don't give a specific number. If you are a workaholic and sense this company would like that, say you are a confirmed workaholic who often works nights and weekends, and your family accepts this because it makes you fulfilled. If you are not a workaholic, say you have always worked hard and put in long hours. It goes with the territory. In one sense, it's hard to keep track of the hours because your work is a labor of love - you enjoy nothing more than solving problems. So you're almost always thinking about your work, including times at home, while commuting, etc."
"What's the most difficult part of being a (job title)?","First, redefine 'difficult' to be 'challenging' which is more positive. Then, identify an area everyone in your profession considers challenging and in which you excel. Describe the process you follow that enables you to get splendid results and be specific about those results. For example: 'I think every sales manager finds it challenging to motivate the troops in a recession. But that's probably the strongest test of a top sales manager. I feel this is one area where I excel. When I see the first sign that sales may slip or that sales force motivation is flagging because of a downturn in the economy, here's the plan I put into action immediately...' (followed by description of each step in the process and the exceptional results achieved)."
"The Hypothetical Problem - How would you handle this difficult situation?","Don't fall into the trap of trying to solve this problem and giving your verdict on the spot, as it's virtually impossible to have all the facts from such a short presentation. Instead, describe the rational, methodical process you would follow in analyzing this problem, who you would consult with, generating possible solutions, choosing the best course of action, and monitoring the results. Remember, in all 'What would you do?' questions, always describe your process or working methods, and you'll never go wrong."
"What was the toughest challenge you've ever faced?","Have a recent example ready that demonstrates either: 1) A quality most important to the job at hand; or 2) A quality that is always in demand, such as leadership, initiative, managerial skill, persuasiveness, courage, persistence, intelligence, etc."
"Have you considered starting your own business?","Gauge this company's corporate culture before answering and be honest. If the culture is that of a large, formal, military-style structure, minimize any indication that you'd love to have your own business. Say you may have given it a thought once or twice, but your whole career has been in larger organizations where you have excelled and where you want to be. If the culture is more free-wheeling, emphasize that in a firm like this, you can get the best of all worlds - the excitement of seeing your own ideas take shape combined with the resources and stability of a well-established organization. In any case, indicate that any desires about running your own show are part of your past, not your present or future."
"What are your goals?","Many executives who might hire you are strong believers in goal-setting. Be ready to discuss your goals for each major area of your life: career, personal development and learning, family, physical health, community service and (if your interviewer is clearly religious) you could briefly allude to your spiritual goals. Be prepared to describe each goal in terms of specific milestones you wish to accomplish, time periods you're allotting, why the goal is important to you, and specific steps you're taking to bring it about. Do this concisely - never talk more than two minutes straight before letting your interviewer back into the conversation."
"What do you look for when you hire people?","Speak your own thoughts, but weave them around the three most important qualifications for any position: 1) Can the person do the work (qualifications)?; 2) Will the person do the work (motivation)?; 3) Will the person fit in (team player)?"
"Sell me this stapler (or some other object on interviewer's desk).","You already know the most important secret of great salesmanship: find out what people want, then show them how to get it. Say: 'Well, a good salesman must know both his product and his prospect before he sells anything. If I were selling this, I'd first get to know everything I could about it, all its features and benefits. Then, if my goal were to sell it to you, I would do some research on how you might use this item. The best way to do that is by asking some questions. May I ask you a few questions?' Then ask questions like 'Just out of curiosity, if you didn't already have one, why would you want one? And in addition to that? Any other reason?' Ask questions that point to the features this item has. Once you've asked these questions, make your presentation citing all the features and benefits and why it's exactly what the interviewer just told you they're looking for. Then close with 'Just out of curiosity, what would you consider a reasonable price for a quality item like this that would solve all those problems?' Whatever they say (unless it's zero), say 'Okay, we've got a deal.'"
"The Salary Question - How much money do you want?","For maximum salary negotiating power, remember these five guidelines: 1) Never bring up salary - let the interviewer do it first; 2) If the interviewer raises salary too early before you've created desire for your qualifications, postpone the question; 3) The #1 rule of negotiation is: the side with more information wins. Get the employer talking about what they're willing to pay before you reveal what you're willing to accept by asking 'I'm sure the company has already established a salary range for this position. Could you tell me what that is?' or 'What does this position pay?'; 4) Know beforehand what you'd accept - research the job market and this position, remembering most executives look for a 20-25% pay boost when switching jobs; 5) Never lie about what you currently make, but feel free to include the estimated cost of all your fringes, which could add 25-50% more to your present cash-only salary."
"Illegal Question - Questions about age, children, marital status, religion, political affiliation, ancestry, national origin, birthplace, disabilities, clubs, etc.","You can handle an illegal question in several ways: 1) Assert your legal right not to answer (but this will destroy rapport); 2) Answer straightforwardly if you feel the answer could help you; 3) Diplomatically answer the concern behind the question without answering the question itself. For example, if asked about age and you're over 50, you can ask with a friendly smile whether there's a concern that your age may affect your performance, then reassure them there's nothing in this job you can't do. In fact, your age and experience are the most important advantages you offer. Most importantly, remember that illegal questions arise from fear that you won't perform well. The best answer of all is to get the job and perform brilliantly."
"The Secret Illegal Question - Unspoken concerns about your ability to handle the job due to being physically challenged, a single mother, over 50, a minority, etc.","Just because the interviewer doesn't ask an illegal question doesn't mean they don't have concerns. Make sure there's enough counterbalancing information to more than reassure them there's no problem in the area they may be doubtful about. For example, if you're a sales rep who uses a cane and you're concerned the interviewer may secretly wonder about your stamina or ability to travel, make sure you hit these abilities very hard, leaving no doubt about your capacity to handle them well. Without seeming defensive, mention strengths, accomplishments, preferences and affiliations that strongly counterbalance any unspoken concern your interviewer may have."
"What was the toughest part of your last job?","State that there was nothing in your prior position that you found overly difficult, and let your answer go at that. If pressed to expand, describe the aspects of the position you enjoyed more than others, making sure you express maximum enjoyment for those tasks most important to the open position, and you enjoyed least those tasks that are unimportant to the position at hand."
"How do you define success and how do you measure up to your own definition?","Give a well-accepted definition of success that leads right into your own stellar collection of achievements. For example: 'The best definition I've come across is that success is the progressive realization of a worthy goal. As to how I would measure up to that definition, I would consider myself both successful and fortunate...' Then summarize your career goals and how your achievements have indeed represented a progressive path toward realization of your goals."
"The Opinion Question - What do you think about abortion, the President, the death penalty, or any other controversial subject?","If you are ever uncomfortable with any question, asking a question in return is the greatest escape hatch ever invented. Simply responding 'Why do you ask?' will usually be enough to dissipate any pressure to give your opinion. If your interviewer again presses you for an opinion, you can ask another question or assert a generality that almost everyone would agree with. For example, if your interviewer is complaining about politicians then asks if you're a Republican or Democrat, you could respond by saying 'Actually, I'm finding it hard to find any politicians I like these days.'"
"If you won $10 million lottery, would you still work?","Focus on your positive feelings about work. After you floated down from cloud nine, you would still hold your basic belief that achievement and purposeful work are essential to a happy, productive life. After all, if money alone bought happiness, then all rich people would be happy, and that's not true. You love the work you do, and you think you'd always want to be involved in your career in some fashion. Winning the lottery would make it more fun because it would mean having more flexibility, more options. Of course, since you can't count on winning, you'd just as soon create your own destiny by sticking with what's worked for you: good old reliable hard work and a desire to achieve. Those qualities have built many more fortunes than all the lotteries put together."
"Looking back on your last position, have you done your best work?","To cover both possible paths this question can take, your answer should state that you always try to do your best, and the best of your career is right now. Like an athlete at the top of their game, you are just hitting your career stride thanks to several factors. Then recap those factors, highlighting your strongest qualifications."
"Why should I hire you from the outside when I could promote someone from within?","Help them see the qualifications that only you can offer. In general, it's a good policy to hire from within - to look outside probably means they're not completely comfortable choosing someone from inside. Naturally, they want this department to be as strong as it possibly can be, so they want the strongest candidate. You feel that you can fill that bill because...' (then recap your strongest qualifications that match up with their greatest needs)."
"Tell me something negative you've heard about our company.","Just remember the rule - never be negative - and you'll handle this one just fine. This is a common fishing expedition to see what the industry grapevine may be saying about the company. But it's also a trap because as an outsider, you never want to be the bearer of unflattering news or gossip about the firm. It can only hurt your chances and sidetrack the interviewer from getting sold on you."
"On a scale of one to ten, rate me as an interviewer.","Never be negative. The interviewer will only resent criticism coming from you. This is the time to show your positivism. However, don't give a numerical rating. Simply praise whatever interview style they've been using. If they've been tough, say 'You have been thorough and tough-minded, the very qualities needed to conduct a good interview.' If they've been methodical, say 'You have been very methodical and analytical, and I'm sure that approach results in excellent hires for your firm.' In other words, pay them a sincere compliment that they can believe because it's anchored in the behavior you've just seen."